question,document
Can I still join the course if I found it late?,74eb249bbf
"If I start now, will I still be able to get a certificate?",74eb249bbf
What do I need to do to qualify for the certificate after joining late?,74eb249bbf
Is it okay to join the course after it has already started?,74eb249bbf
Do I have to submit the project before submissions close to get certified?,74eb249bbf
"I registered for LLM Zoomcamp, but I never got any confirmation email — should I be worried or wait for one?",977bf7786c
Do I need to get an acceptance or confirmation message before I can start the course and submit homework?,977bf7786c
"If I didn’t sign up through the registration form, can I still begin the course and turn in assignments while submissions are open?",977bf7786c
"Is there actually a list of registered students that homework is checked against, or is registration just for something else?",977bf7786c
What is the purpose of the course registration if it doesn’t seem required to join or submit homework?,977bf7786c
How do students join the Office Hours or live workshop sessions if they don’t get the Zoom link?,489dd1c9d9
Where is the live stream link for Office Hours usually posted before the session starts?,489dd1c9d9
"Can I watch the workshop live on YouTube instead of Zoom, and where do I find it?",489dd1c9d9
"If I want to ask questions during the live session, should I use chat or Slido?",489dd1c9d9
Why is the Zoom link for Office Hours not shared with students directly?,489dd1c9d9
Where should I begin if I want to follow LLM Zoomcamp the right way?,04919992b3
"What’s the usual weekly routine for this course, from videos to homework submission?",04919992b3
"Do I have to start the course at a specific time, or can I begin whenever I want?",04919992b3
"What should I read first: the docs, the GitHub repo, or the course platform?",04919992b3
How do the lesson exercises and homework usually differ in LLM Zoomcamp?,04919992b3
How do I find my own entry on the leaderboard if I can't spot my name there?,c2903069a0
What do I need to click to see my display name in the course profile?,c2903069a0
"Why am I shown a random name on the leaderboard, and can I change it?",c2903069a0
Which name should I put in the profile if I want a different nickname instead of the default one?,c2903069a0
What should I update in my profile so my certificate shows my real official name?,c2903069a0
Can I take the course at my own pace and still earn a certificate?,69d122f12e
Is there any way to get a certificate if I don't join a live cohort?,69d122f12e
Do you give certificates for the self-paced version of the course?,69d122f12e
Why can't I receive a certificate after finishing the course on my own?,69d122f12e
Do I need to do peer reviews to be eligible for the certificate?,69d122f12e
"Do I still qualify for the certificate if I skipped the first homework, or do I need to make it up?",9f689c185f
"Is passing the Capstone project enough to get the course certificate, even if I miss some homework?",9f689c185f
"Are homework assignments required for certification in this course, or are they just optional practice?",9f689c185f
"If homework isn't mandatory, does it still affect anything important like my ranking or score?",9f689c185f
What’s the minimum requirement to receive the certificate in llm-zoomcamp?,9f689c185f
Why does the homework content keep changing before it’s released?,96286b4be4
What does it mean when a homework title has [DRAFT] in it?,96286b4be4
How can I tell if a homework assignment is actually ready?,96286b4be4
Is it safe to start working on homework while it still looks like a draft?,96286b4be4
Can homework still be updated even after the form is open?,96286b4be4
When is the next time this course will run?,bd31146b0e
Do you know when llm-zoomcamp will be offered again?,bd31146b0e
What’s the next scheduled offering for this course?,bd31146b0e
When should I expect the next cohort of the course to start?,bd31146b0e
Is there a date for the next course run?,bd31146b0e
Where can I find the course lectures or videos for this class?,31456f4b5f
Is there a main place I should check first for the LLM Zoomcamp lessons?,31456f4b5f
How do I get to the videos for each lesson in the repo?,31456f4b5f
Why does everyone say to use the GitHub repo instead of just the YouTube playlist?,31456f4b5f
"If I want the latest lesson videos, where should I look?",31456f4b5f
"How do I keep track of the LLM Zoomcamp syllabus, homework deadlines, and my progress?",20c5a1347e
Is there a place for seeing the current LLM Zoomcamp cohort structure and assignments?,20c5a1347e
What platform should I use to follow the course schedule and homework for LLM Zoomcamp?,20c5a1347e
Where can I find the LLM Zoomcamp deadlines and progress tracker in one place?,20c5a1347e
Does LLM Zoomcamp use the same course management system as the other DataTalks.Club Zoomcamps?,20c5a1347e
"Does LLM Zoomcamp have live sessions or office hours for every module, or is everything mainly pre-recorded?",d65e05bd7a
"If I get stuck on a module, what’s the best place to ask for help—Slack or somewhere else?",d65e05bd7a
"Are live sessions in the course scheduled regularly, or do they only happen when the team announces them?",d65e05bd7a
"Is there any optional paid support with Zoom office hours for LLM Zoomcamp, and how does it work?",d65e05bd7a
Where can I find the module materials if there aren’t separate live classes each week?,d65e05bd7a
Can I count my Bluesky posts for the learning in public credits in this course?,dbf5369006
Does posting on Bluesky qualify for the public learning credit requirement?,dbf5369006
Are Bluesky updates accepted as learning in public evidence for course credits?,dbf5369006
"If I share my progress on Bluesky, will that be enough for learning in public credits?",dbf5369006
Is Bluesky one of the platforms I can use to earn learning in public credits?,dbf5369006
Where can I find the Telegram channel for LLM Zoomcamp?,054f3fd58f
What’s the Telegram link for the LLM Zoomcamp course?,054f3fd58f
Is there a Telegram group or channel for LLM Zoomcamp announcements?,054f3fd58f
Where should I join to get LLM Zoomcamp updates on Telegram?,054f3fd58f
"What’s the official Telegram channel for LLM Zoomcamp, and is it only for announcements?",054f3fd58f
Why does my FAQ dataset have a different number of records than the one shown in the course videos?,e2d595f23c
Is it normal if the live FAQ data count doesn’t match the number in the recordings?,e2d595f23c
The FAQ dataset changed from the video demo — did I do something wrong?,e2d595f23c
Why are there extra or missing questions in the FAQ data compared to the lecture?,e2d595f23c
How can the FAQ dataset be different now if the videos were recorded in May 2026?,e2d595f23c
"The homework deadline already passed, but the form still lets me submit — does that mean my work is still accepted?",a9353fadfe
Can I turn in homework after the deadline if the submission page hasn’t been closed yet?,a9353fadfe
"I missed the listed deadline, but the submission form is still open. Should I still send my answers?",a9353fadfe
Does the deadline matter if the homework form is still available for submissions?,a9353fadfe
At what point is homework submission actually no longer possible — after the deadline or only after the form closes?,a9353fadfe
Can I still turn in homework after the deadline if the submission form is open?,cdc3b285e5
Do you ever give deadline extensions for homework in this course?,cdc3b285e5
"What happens if I miss a homework assignment, will it stop me from getting the certificate?",cdc3b285e5
Are late homework submissions accepted once the form is closed?,cdc3b285e5
"Do homework scores matter for the certificate, or are they only used for the leaderboard?",cdc3b285e5
"If I enter my real name in the certificate field, does it get shown on the public leaderboard or shared with anyone else?",651ba06b34
"What name do other people see on the course leaderboard, and is it different from the name printed on my certificate?",651ba06b34
Can I keep my real name private on the leaderboard but still have it on the certificate?,651ba06b34
"In the course profile, which field is for the public nickname and which one is for the official certificate name?",651ba06b34
"Does the certificate name ever get published online, or is it only used on the certificate itself?",651ba06b34
Why don't we use LangChain in this course if it already helps build LLM apps?,b7cdde6b25
"What’s the reason for building retrieval, indexing, and prompting from scratch before any framework?",b7cdde6b25
Is there a specific benefit to learning the core RAG pieces before using LangChain?,b7cdde6b25
Wouldn’t it be easier to just use a framework like LangChain instead of implementing the basics ourselves?,b7cdde6b25
"Why do you compare this course approach to learning HTML, CSS, and JavaScript before React or Angular?",b7cdde6b25
Why do I get an OpenAI API error about insufficient credits when I run `responses.create`?,f5df151c59
What does the error `OpenAI API Error: Insufficient credits` mean in the OpenAI `responses.create` command?,f5df151c59
I’m seeing a credit-related failure in `responses.create`; is my OpenAI account out of credits?,f5df151c59
How do I fix the `Insufficient credits` error from OpenAI when using `responses.create`?,f5df151c59
Could the `responses.create` command fail because my OpenAI balance is too low?,f5df151c59
"Why am I getting a 429 RateLimitError from OpenAI saying I exceeded my quota, and how do I fix it?",152af39a53
"Do I need to add billing credits to use the OpenAI API, or is there any free quota left?",152af39a53
"After topping up my OpenAI account, do I have to create a new API key before trying again?",152af39a53
How do I know which OpenAI model names I’m allowed to use in `responses.create(...)`?,152af39a53
What should I check in my OpenAI account if my request keeps failing with `insufficient_quota`?,152af39a53
How much should I expect to spend on the OpenAI API for this course?,554d0eb78b
Do I need to pay a lot to use the OpenAI API in the course assignments?,554d0eb78b
"What is the minimum I can top up for the OpenAI API, and is that enough for course use?",554d0eb78b
"Will the OpenAI API costs for the course be more than a few cents, or is it really cheap?",554d0eb78b
How much money do I need to start using the OpenAI API for this course?,554d0eb78b
Do I need to subscribe to the OpenAI API to finish the course homework?,85384a18e5
"Will I have to pay for OpenAI in this course, or are there free options?",85384a18e5
Can I complete the RAG assignments without using a paid OpenAI account?,85384a18e5
What should I use instead of OpenAI API if I don’t want to spend money?,85384a18e5
Does the course provide any free or cheap alternatives to OpenAI API?,85384a18e5
Why does the course recommend using uv instead of just pip and virtualenv for setup?,f81dea8f7e
"What makes uv better or easier than the usual Python tools like pip, virtualenv, and poetry?",f81dea8f7e
"Do I have to switch to uv for this course, or can I keep using pip and virtualenv?",f81dea8f7e
"How does uv help with managing Python versions, environments, and dependencies in one place?",f81dea8f7e
What is the main reason the lessons use uv when other Python package managers still work?,f81dea8f7e
Why does my Jupyter notebook not see OPENAI_API_KEY even though I put it in a .env file?,86d99bbf21
What do I need to install so my notebook can load API keys from .env?,86d99bbf21
Where should I call load_dotenv() before using the OpenAI client in Jupyter?,86d99bbf21
Could the problem be that my env var name is wrong if OPENAI_API_KEY is not detected?,86d99bbf21
How do I make sure the notebook picks up OPENAI_API_KEY from the .env file?,86d99bbf21
How do I keep my API keys in a .env file and load them in Python for this RAG project?,233dabe430
What’s the best way to use python-dotenv to read OPENAI_API_KEY or GROQ_API_KEY from environment variables?,233dabe430
"Should I put .env in gitignore before saving my keys, and how do I set that up?",233dabe430
What do I need to install and import so my app can read API secrets from a local .env file?,233dabe430
"Can you show a simple example of storing Gemini, OpenAI, and Groq keys in .env and accessing them with os.getenv()?",233dabe430
Is it okay if I don’t use the model the homework recommends and pick a different one instead?,ee43413718
"Can I do the RAG homework with OpenAI alternatives like Gemini, Groq, Azure OpenAI, or even a local model?",ee43413718
"Do I need a paid AI service for this assignment, or is there a way to complete it for free?",ee43413718
"If I switch to another LLM provider, will I have to change the code because the API format is different?",ee43413718
Where can I find a list of other model providers I can use for this homework?,ee43413718
How do I hook up Gemini in the Module 1 notebook if I want to use the OpenAI-style endpoint instead of the usual one?,0ae5c221b9
What do I need to put in my .env and client setup to call a Google Gemini model from the notebook?,0ae5c221b9
Why does the notebook code need changes when I switch from the Responses format to Gemini's chat completions endpoint?,0ae5c221b9
How do I write the llm helper for Gemini so it sends both the instructions and the user message correctly?,0ae5c221b9
Which parts of the Module 1 code usually break or need updating when using Gemini models through the OpenAI-compatible API?,0ae5c221b9
How do I get a Pydantic object back from Gemini if the Responses API parse method isn’t there?,341f71f28c
Can I still use the OpenAI SDK to parse structured output from Gemini through the compatible endpoint?,341f71f28c
What’s the right way to define the schema so Gemini returns a list of FAQ items as typed objects?,341f71f28c
Which method should I call instead of responses.parse when using a chat-completions model like Gemini?,341f71f28c
"Do I need to manually load JSON, or does the SDK give me the parsed result directly?",341f71f28c
"How do I install Ollama on Mac, Windows, or Linux?",1d0b969028
"After installing Ollama, what do I run to start the local LLaMA 3 model?",1d0b969028
How can I check if the Ollama server is working on my machine?,1d0b969028
What package do I need in Python to use Ollama from code?,1d0b969028
Can you show a simple Python example for chatting with llama3 using Ollama?,1d0b969028
How do I fix a connection refused error when I try to prompt Ollama in the RAG homework?,c6fc2d4d11
"If Ollama stops responding in Module 1 RAG, what should I do to get the server running again?",c6fc2d4d11
What command do I use to restart the Ollama server in the notebook after a connection refused issue?,c6fc2d4d11
"Why am I getting a connection refused error with Ollama, and how can I recover it without restarting everything?",c6fc2d4d11
"Do I need to rerun the ollama serve cell after restarting the notebook, or is one restart enough?",c6fc2d4d11
Why does `tiktoken` give me a smaller token count than OpenAI’s API for the same prompt?,bf0403d21b
"In `chat.completions.create()`, what extra tokens does OpenAI add that I don’t see in my text?",bf0403d21b
"Could newlines, spaces, or weird Unicode characters change the token count between my code and OpenAI’s report?",bf0403d21b
"If my prompt is 320 tokens in `tiktoken`, why might OpenAI show something like 327 tokens instead?",bf0403d21b
How does OpenAI count chat messages differently from just encoding the raw prompt text?,bf0403d21b
How can I set my API key once so I don't need to export it in every new terminal session?,8b2f5e9d04
"Is there a way to auto-load my `.env` file when I enter a project folder, instead of typing exports by hand?",8b2f5e9d04
"For a project with OpenAI credentials, what’s the easiest setup that works across different shells and operating systems?",8b2f5e9d04
"If I’m working in GitHub Codespaces, should I still keep secrets in `.env`, or is there a better option?",8b2f5e9d04
How do I load a `.env` file automatically in a Python script without manually reading environment variables?,8b2f5e9d04
How do I decide on field weights in minsearch without just guessing?,87d4ea4e08
Is there a good way to tune search field weights besides trial and error?,87d4ea4e08
What’s the best method to test different field weights for retrieval quality?,87d4ea4e08
Should I build a small labeled set before changing weights in my search engine?,87d4ea4e08
Which metrics should I use to compare field weight settings for RAG search?,87d4ea4e08
What’s the best way to clean documents before using them for RAG so retrieval works better?,649c280e6d
"Which junk should I remove from my docs, and what context should I keep for RAG?",649c280e6d
"Do I need to turn my data into JSON for RAG, or is any structured format fine?",649c280e6d
How should I chunk documents for RAG so I don’t lose important context?,649c280e6d
What kind of metadata is worth saving when preparing docs for retrieval?,649c280e6d
"In GitHub Codespaces, `uv` prints “Failed to hardlink files” — should I worry about it or is the install still fine?",acf8fa5356
"Why does `uv` complain about hardlinking in Codespaces, and what does it do instead?",acf8fa5356
How can I stop the `uv` hardlink warning just for my current terminal session?,acf8fa5356
What’s the easiest way to make `uv` use copy mode by default every time I open a shell?,acf8fa5356
Is there a setting in `uv` for Codespaces when hardlinks aren’t possible between cache and the environment?,acf8fa5356
"I keep getting ""dotenv is not recognized"" in my RAG project — which package am I supposed to install?",0bed1f48da
What should I add with uv if load_dotenv / dotenv isn’t working in Module 1?,0bed1f48da
Is there a specific Python package for using .env files in llm-zoomcamp?,0bed1f48da
"How do I fix the ""dotenv not recognized"" error when following the course code?",0bed1f48da
"After installing the env package, how do I import it and load variables in Python?",0bed1f48da
Can I do this module on my own machine instead of using Codespaces?,aa310de435
"Is Codespaces required, or can I set everything up locally for the course?",aa310de435
What do I need installed if I want to run the course on my laptop?,aa310de435
"If I use a local setup, do I need to keep track of how I configured it?",aa310de435
Why is Codespaces recommended if local development is also allowed?,aa310de435
"If I keep coding in GitHub Codespaces but never commit, where does that work actually live?",610ccb23c0
"Does uncommitted code in Codespaces stay safe, or can it disappear later?",610ccb23c0
"When I save files in Codespaces without pushing to GitHub, is that enough to keep my work?",610ccb23c0
Should I still commit regularly in Codespaces even if the code is already saved in the Linux VM?,610ccb23c0
"What happens to my Codespaces changes if the session stops, disconnects, or the environment gets deleted?",610ccb23c0
Why does WSL2 say the model needs more system memory than is available even though my PC has enough RAM?,f3dd94f323
How do I change the amount of RAM WSL2 can use on Windows?,f3dd94f323
Where should I put the .wslconfig file to give WSL2 more memory?,f3dd94f323
What do I need to add inside .wslconfig to increase WSL2 memory allocation?,f3dd94f323
"After editing WSL2 memory settings, how can I restart it and check that the new RAM limit is active?",f3dd94f323
My Codespace is stuck on “Finishing up” and never opens — what are the first things I should try?,830f3d2018
"If a Codespace won’t reconnect in GitHub, is there a quick fix besides waiting?",830f3d2018
"Why does my setup seem to vanish after a rebuild or new Codespace, and is that normal?",830f3d2018
Do files in /workspaces stay there when I stop and start the Codespace again?,830f3d2018
What should I do if GitHub Codespaces keeps acting flaky and I don’t want to lose my work?,830f3d2018
"Can I swap OpenAI for another LLM provider if it's blocked where I live, or am I stuck with the course setup?",c6ff9083c0
"Which providers actually work with the course code without a big rewrite, like Groq, OpenRouter, DeepSeek, Gemini, or Mistral?",c6ff9083c0
"If I use a different API, do I only need to change the endpoint URL, key, and model name in the OpenAI client?",c6ff9083c0
"Can I run the model on my own machine with something like Ollama, vLLM, or LM Studio instead of calling an external API?",c6ff9083c0
What if my laptop can't handle the model I want — is renting a GPU server and pointing the course code to it a good option?,c6ff9083c0
"Why am I getting 429 errors in my notebook when I loop over a lot of docs, and what should I change first?",8e21752415
What’s a good way to stop OpenAI rate limit problems during the course without waiting for the error to happen?,8e21752415
How can I make my API calls less likely to hit per-minute limits in RAG notebooks?,8e21752415
"Do I need to handle 429s manually, or does the OpenAI client already retry for me?",8e21752415
"If I rerun a notebook, how do I avoid paying for or redoing the same embeddings and responses again?",8e21752415
"In agentic RAG, what exactly counts as a tool or function, and how are they different from the model itself?",c296ea5a21
Why do people use the terms tool and function almost interchangeably in this course?,c296ea5a21
What kinds of tasks can a model pass to a tool or function instead of doing everything on its own?,c296ea5a21
"How does tool use change the flow compared with basic RAG, where retrieval happens first no matter what?",c296ea5a21
When should the model decide to call a tool or function during an agentic RAG setup?,c296ea5a21
What free models can I use if I want tool use support for development?,0d74a3616f
Does Groq have any models that support tools or function calling for free?,0d74a3616f
"Besides Groq, which other providers support tool or function calling?",0d74a3616f
Can I use Deepseek R1 or Llama 4 with tool use without paying?,0d74a3616f
Do I need to change my code when switching from OpenAI to Groq or other model providers for tools?,0d74a3616f
Why do I get `AttributeError: 'str' object has no attribute 'output'` when I switch from OpenAI to another model in an agent?,9e7b3f0c25
"Can I use `client.responses.create(...)` with Mistral or Groq, or is that only for OpenAI models?",9e7b3f0c25
What should I use instead of `response.output` when my provider doesn’t support the Responses API?,9e7b3f0c25
How do I change my code to work with `chat.completions.create(...)` for non-OpenAI providers?,9e7b3f0c25
Do I need to modify the tools schema too when I move an agent from OpenAI’s Responses API to another LLM provider?,9e7b3f0c25
Why am I getting `Missing required parameter: 'tools[0].function'` when I use Azure OpenAI in Module 1?,b9c7c6bb34
How should I format my `get_weather_tool` JSON so the tool call works with Azure OpenAI?,b9c7c6bb34
"Do I need a `function` field inside `tools[0]` for the weather tool, and what should it look like?",b9c7c6bb34
What is the correct JSON structure for the `get_weather` tool in the Agentic RAG exercise?,b9c7c6bb34
Can you show the fixed `get_weather_tool` definition for the weather example using Azure OpenAI?,b9c7c6bb34
"Why do I get a 404 error with toyaikit on Groq, and what part of the API is it actually calling?",0224d980b3
How can I run toyaikit with Groq or another OpenAI-compatible provider without hitting the OpenAI Responses endpoint?,0224d980b3
What do I need to change in toyaikit if I want to use Anthropic models instead of OpenAI ones?,0224d980b3
"Can I use the same toyaikit tools setup with Groq or Anthropic, and what runner/client classes should I pick?",0224d980b3
"In toyaikit, what's the difference between `runner.loop(prompt=...)` and `runner.run()`, and when should I use each?",0224d980b3
Where do I actually find the Module 1 homework questions for the 2026 cohort?,53f15299b6
"Is the homework listed only in the course platform, or should I check the GitHub repo too?",53f15299b6
Can you point me to the right page for the 2026 Module 1 homework instructions?,53f15299b6
I’m looking for the Module 1 homework links—where are they posted?,53f15299b6
"For llm-zoomcamp, what’s the best place to see the homework tasks and any extra notes?",53f15299b6
Why am I getting an empty list after filtering my query in this homework task?,83da208a64
Could this empty result be caused by a problem with how I indexed the data first?,83da208a64
Do I need to set the index settings before I load the documents into Elasticsearch?,83da208a64
What should I check if my filters and query return nothing in HW Q3?,83da208a64
"Is the issue with my query, or did I probably add the data to the index in the wrong order?",83da208a64
Why do I get a 402 error from OpenRouter when I call responses.create() in my homework code?,cfb07a27d5
How can I fix the OpenRouter APIStatusError 402 that happens before the model even runs?,cfb07a27d5
What should I set for max_output_tokens in responses.create() so OpenRouter stops rejecting my request?,cfb07a27d5
"In rag_helper.py, where do I add the output token limit for Module 1 homework?",cfb07a27d5
Why does OpenRouter give 402 here instead of the 429 quota error I usually see with OpenAI?,cfb07a27d5
"In the Module 1 homework, what does it actually mean to point RAG at the chunk index instead of the full documents?",b4300adeb1
Should I build the search index from the original documents or from the split chunks in the homework?,b4300adeb1
"If I already have `documents` and `chunks`, which one should I use with `index.fit()` for RAG?",b4300adeb1
Why does the homework say to retrieve chunks for the prompt instead of sending the whole document text?,b4300adeb1
What’s the difference between using `index.fit(chunks)` and `index.fit(documents)` in this RAG setup?,b4300adeb1
