question,document
"Should I include actual keys in the repo, or is there a safer way to handle environment variables for reviewers?",e5d8a2c761
What’s the best way to make the search index or dataset setup repeatable for a peer reviewer?,e5d8a2c761
"How do I keep the project cheap and reproducible for reviewers, including model choice and dependency versions?",e5d8a2c761
"Can I do the homework and capstone project in something other than Python, like JavaScript, Go, or Rust?",ea815eb858
Is it okay to use a non-Python stack for this course if I have a good reason?,ea815eb858
"If I submit the project in another language, what should I put in the README so the reviewer can run it?",ea815eb858
"Do I have to explain how to install and run a non-Python project on Windows, macOS, and Linux?",ea815eb858
"Will a project built in Go, Java, or TypeScript still be accepted if it’s easy to reproduce and review?",ea815eb858
Where do I check out past LLM Zoomcamp capstone projects?,930286278d
Is there a page with previous LLM Zoomcamp project submissions I can browse?,930286278d
Can I see examples of capstone projects from earlier LLM Zoomcamp cohorts?,930286278d
Where are the 2024 and 2025 LLM Zoomcamp projects listed?,930286278d
I want to get a sense of the expected capstone scope—where can I find old project repos?,930286278d
"Do I have to announce my capstone project idea before I start working on it, or can I just begin without reserving it anywhere?",897a350476
"Is it necessary to claim or reserve a project topic for the LLM Zoomcamp capstone, or is that not required?",897a350476
"If I already have an idea for the capstone project, do I need to post it somewhere first, or can I keep going and only ask for feedback later?",897a350476
"Can I work on a project that is similar to one from a previous year, or does it have to be completely unique?",897a350476
Where can I check old capstone projects to get a sense of the expected scope before I choose my own idea?,897a350476
Can I build my capstone as a Telegram or WhatsApp bot instead of a web app?,7318a90b14
"Is a CLI, notebook, or Slack app acceptable for the project interface?",7318a90b14
"Do you require one specific way to expose the project to users, or can I choose whatever fits my idea?",7318a90b14
Will the course show me how to make a Telegram/WhatsApp or other user interface for the capstone?,7318a90b14
"As long as the project meets the evaluation criteria, can I use any frontend or access method I want?",7318a90b14
"What tool should I use to pull text out of PDFs for a RAG app, or does the course not care which one I pick?",d8b28c47a0
"If my PDFs are scanned images and not real text, what OCR option should I use for the capstone project?",d8b28c47a0
"Can I use docling or PyMuPDF to turn PDFs into Markdown for retrieval, and is that okay for this course?",d8b28c47a0
What should I do if I have mixed document types and weird layouts — is there a library that handles that better?,d8b28c47a0
"After extracting text from my PDFs, how do I decide which tool gives the cleanest output for my dataset?",d8b28c47a0
Can I reuse the workshop content in my own capstone project?,d850a0e7ea
Is it okay to use dlt from this workshop in other Zoomcamp projects too?,d850a0e7ea
Can I take the materials from this open-source workshop and apply them to my own data project?,d850a0e7ea
"If I’m doing the MLOps Zoomcamp project, can I still use dlt from this workshop?",d850a0e7ea
Where can I ask questions if I want to use these workshop materials in my project?,d850a0e7ea
How do I create a new dlt project for loading data from cloud storage?,6bceeebf04
What command should I run to start a dlt filesystem to duckdb project?,6bceeebf04
I'm trying to set up dlt from cloud sources—what's the initial init command?,6bceeebf04
Which dlt init command do I use when working with filesystem data and duckdb?,6bceeebf04
Where do I begin if I want to load cloud files into duckdb with dlt?,6bceeebf04
"Why do I get `FileNotFoundError: Table notion_pages___homework does not exist` when I call `db.open_table(""notion_pages___homework"")`?",0407213397
What does it mean if the table exists error tells me to first call `db.create_table(...)` in the dlt workshop?,0407213397
I renamed my homework table but still get an error opening it—what am I probably missing in the pipeline settings?,0407213397
How can I fix the `notion_pages___homework` table not found issue in the Open-Source Data Ingestion workshop?,0407213397
"If `db.open_table(""notion_pages___homework"")` fails, is there somewhere else besides the table name I should check?",0407213397
Why do I get FileNotFoundError saying the notion_pages___homework table doesn’t exist when I run main()?,e95bfafc0e
How should I fix the table name in line 3 if db.create_table complains about notion_pages___homework?,e95bfafc0e
What is the right way to open the homework table in the dlt workshop code?,e95bfafc0e
I’m seeing an error about a missing table during main() — which table name should I use in db.open_table()?,e95bfafc0e
Can someone show the correct line for opening notion_pages___homework in the script?,e95bfafc0e
How can I check what tables are already in the database?,e394e6f738
Is there a way to list all the tables from the db directly?,e394e6f738
What method should I use to see the table names in the database?,e394e6f738
How do I find out which tables exist in the db?,e394e6f738
"If I want to inspect the database tables, what should I call?",e394e6f738
"Does dlt already support ClickHouse or StarRocks connectors, or are they still missing?",cd19f122f3
"Can I use dlt with ClickHouse or StarRocks right now, or do I need to build something myself?",cd19f122f3
Are there official connectors in dlt for ClickHouse and StarRocks?,cd19f122f3
"If dlt doesn't have ClickHouse or StarRocks connectors, is there any plan for the community to add them?",cd19f122f3
"Why can't I find ClickHouse or StarRocks connectors in dlt, and is that something contributions can help with?",cd19f122f3
"Why do I get a 401 Unauthorized when my notebook tries to call the Notion search API, and what should I check first?",0dfba07ace
What usually causes the notebook to say it has no secret access for api.notion.com/v1/search?,0dfba07ace
How can I fix a Notion API authorization error in the dlt workshop notebook?,0dfba07ace
Could this 401 error be from a bad token or wrong permissions in my Notion setup?,0dfba07ace
What should I verify if the notebook can’t access the Notion API and keeps failing with Unauthorized?,0dfba07ace
"Why does pip keep giving me requests 2.28 when lancedb needs 2.32, and how do I install the newer one from source?",4b30b918bc
What command should I use to force-install requests v2.32.3 instead of the older version?,4b30b918bc
I'm getting a 401 Client Error during setup—does that mean my key is wrong or access isn't enabled?,4b30b918bc
How can I make sure requests is installed from the GitHub release zip rather than the default package version?,4b30b918bc
Is there a direct pip install line for the exact requests version needed by lancedb?,4b30b918bc
