question,document
Do I have to get the homework numeric answer exactly equal to one of the multiple-choice options?,5e4ca64cb5
What should I do if my homework result is a little different from every option in Module 1?,5e4ca64cb5
Why might my homework answer not match the choices exactly even if my code seems right?,5e4ca64cb5
"If my number is close to an option but not identical, should I pick the nearest one or keep looking?",5e4ca64cb5
"When should I re-check the dataset, filtering, or homework instructions because my answer looks off?",5e4ca64cb5
"When the homework wording feels vague, should I check the course page first or the GitHub instructions?",7d3a2e3505
"For Module 1 in the 2026 cohort, where exactly are the materials and homework directions?",7d3a2e3505
Why does the homework sometimes seem different from the lesson if it’s based on the same topic?,7d3a2e3505
"If I still can’t make sense of a homework task, what’s the best way to ask for help in Slack?",7d3a2e3505
What should I include when I ask about homework confusion so people can actually help me?,7d3a2e3505
How can I get the token count for Module 1 homework when I'm using a provider that isn't OpenAI?,fe8fed31e6
Where should I look for token usage in the response object if I use an OpenAI-compatible client for the homework?,fe8fed31e6
"Is it okay to use tiktoken or cl100k_base for Gemini, Mistral, Groq, or Hugging Face in this homework?",fe8fed31e6
What should I do if my model provider doesn't return any token usage information?,fe8fed31e6
"For the multiple-choice token-count question in Module 1, should I pick the exact number or the closest answer?",fe8fed31e6
"Why does the homework checker say my repo link is not 200, and what should I change so it passes?",bcdb8740ce
I submitted my GitHub URL for the module 1 homework and got a 500/404 error — what’s usually wrong with the link?,bcdb8740ce
Do I need to make my homework repository public for the checker to access it?,bcdb8740ce
Should I remove the .git part from the GitHub repo URL before submitting it?,bcdb8740ce
How can I quickly test whether my repository URL is reachable by the submission checker?,bcdb8740ce
"What exactly are embeddings in vector search, and why do we need them?",69430a79a8
How do embeddings turn text or other non-numeric data into numbers without losing meaning?,69430a79a8
Why should similar pieces of data produce close vectors after embedding?,69430a79a8
How do embeddings help with semantic similarity and comparing meaning?,69430a79a8
Is embeddings related to vector space models or dimensionality reduction in any way?,69430a79a8
"How can I get rid of the warning about the ""multi-qa-mpnet-base-dot-v1"" model and sentence-transformers version?",aa3f597424
Is there a way to suppress the sentence transformers v3.0.0 beta warning when using that embedding model?,aa3f597424
What should I install or upgrade if I keep seeing this warning during vector search?,aa3f597424
"Why am I getting the notice that the model was made with sentence-transformers v3, and how do I make it stop?",aa3f597424
"Do I need to update sentence-transformers to fix the ""multi-qa-mpnet-base-dot-v1"" warning?",aa3f597424
"Why did the lesson use a plain dot product for similarity instead of cosine, and is that always valid?",92cd22cada
"In the homework, why do we need to normalize embeddings before comparing them, unlike in the lecture example?",92cd22cada
"If my vectors come from the model already normalized, can I just use dot product as cosine similarity?",92cd22cada
What changes between the lecture embeddings and the homework embeddings that makes normalization necessary?,92cd22cada
How can I tell whether dot product is enough or whether I need to normalize first?,92cd22cada
"When I'm building vector search for the course, is there one best choice for embeddings, or do I need to test a few options?",5c4a8d2e60
"Should I vectorize just the answer text, just the question, or both together for the best search results?",5c4a8d2e60
Why would embedding only the answer still work well in a question-answer retrieval setup?,5c4a8d2e60
"If my users type questions, does it make sense to index only the original questions instead of the answers?",5c4a8d2e60
"Is combining the question and the answer into one embedding worth it, even if it costs a bit more?",5c4a8d2e60
What exactly does cosine similarity measure when comparing two vectors?,db78580409
How do you use cosine similarity to compare two documents in text analysis?,db78580409
"What does it mean if cosine similarity is 1, 0, or -1?",db78580409
Why is cosine similarity commonly used with word counts or TF-IDF vectors?,db78580409
"Can cosine similarity be applied to any vectors, or only non-zero ones?",db78580409
Why does cosine similarity turn into a dot product once the embeddings are normalized?,95feb4e75b
How does normalizing vectors let us compute similarity with matrix multiplication?,95feb4e75b
"In vector search, why can cosine similarity be computed just by multiplying the embedding matrix by the query vector?",95feb4e75b
"What changes when all document embeddings and the query are unit length, so cosine similarity becomes faster to calculate?",95feb4e75b
Why is cosine similarity basically the same as a dot product in this setup?,95feb4e75b
"For Module 2, do I need to create a brand-new GitHub repo, or is a separate Codespace enough?",1e829a8c6f
"Should I keep using my Module 1 Codespace, or is it better to start a fresh one for vector search?",1e829a8c6f
"If I set up Module 2 in Codespaces, do I have to make a new repository first?",1e829a8c6f
Why does the course recommend a separate Codespace for Module 2 instead of reusing the old one?,1e829a8c6f
"When I'm done with the Module 2 Codespace, is it okay to delete it as long as I committed my changes?",1e829a8c6f
"Why does download.py get stuck at 0% when trying to fetch model.onnx from HuggingFace, and is there a workaround?",29b69fbe0b
My model.onnx download never moves past 0% in download.py — is HuggingFace’s CDN the problem?,29b69fbe0b
"Can I manually grab model.onnx from the browser if download.py hangs, and where should I put it?",29b69fbe0b
What should I do if the script seems frozen while downloading the ONNX file from HuggingFace?,29b69fbe0b
"If I already saved model.onnx locally, will download.py still try to fetch it again?",29b69fbe0b
"Why do the matrix and for-loop versions of vector search give slightly different answers, even though they should be the same dot product?",e889793af9
"Is it normal that `np.allclose(scores, scores_loop)` can return `False` for the matrix version and the loop version of vector search?",e889793af9
What makes `X.dot(v_query)` not match a Python loop exactly when calculating vector search scores?,e889793af9
Should I worry if the two vector search implementations differ in the last decimal places?,e889793af9
How can I compare the results of `scores = X.dot(v_query)` and the loop version without expecting an exact match?,e889793af9
Why am I getting IndexError: list index out of range when I try to access the best chunk?,1a7b27c4df
What usually causes list index out of range in vector search when picking the top chunk?,1a7b27c4df
How do I make sure my embeddings match the chunks so I don't hit this error?,1a7b27c4df
Should I create embeddings from the whole chunks list or from chunk content only?,1a7b27c4df
Why does the number of vectors have to be the same as the number of document chunks?,1a7b27c4df
Why is my cosine similarity answer for Module 2 Homework Q2 not matching any of the multiple-choice options?,eaa17a9dc6
Do I need to use the `Embedder` from `embedder.py` for Homework 2 instead of `sentence-transformers`?,eaa17a9dc6
"Could the wrong embedding model, like `multi-qa-mpnet-base-dot-v1` or `all-mpnet-base-v2`, be why my cosine score is different?",eaa17a9dc6
"For Q2, should I be embedding the `content` field only, or am I supposed to use the filename or the whole record?",eaa17a9dc6
"If my cosine similarity is still a little off after using the right setup, should I just choose the nearest option?",eaa17a9dc6
How should I set up the Gemini key for Kestra — do I need both the normal env var and the base64 one?,3860e5fe8b
What’s the right way to export OpenAI and Tavily keys so Kestra can see them in the flows?,3860e5fe8b
"Do I need to restart Docker or Kestra after adding the secret variables, or can it pick them up automatically?",3860e5fe8b
"In a Kestra flow, should I use the name with SECRET_ or without it when calling secret()?",3860e5fe8b
"Why does Kestra require the API keys to be base64-encoded and prefixed with SECRET_, and where do I put those exports?",3860e5fe8b
"Why does Kestra AI Copilot keep saying it can only help with creating flows, and what am I missing in my setup?",04440cab11
I set up the course project but the Copilot still refuses to answer — do I need a different Gemini key env var for it?,04440cab11
What should I export before running `docker compose up` so Kestra’s Copilot actually works instead of giving that canned reply?,04440cab11
Could this Copilot error be because I used the base64 secret variable from the flows instead of the plain Gemini API key?,04440cab11
"If the Gemini key is already set and Copilot still fails, what else should I check like quota, typos, or restarting Kestra?",04440cab11
Why does Kestra say my Gemini API key is invalid even though I already exported SECRET_GEMINI_API_KEY?,c8ca21af33
Do I need to restart the Kestra container after changing the API key environment variables?,c8ca21af33
Should I use {{ secret('GEMINI_API_KEY') }} or {{ secret('SECRET_GEMINI_API_KEY') }} in the flow?,c8ca21af33
Can a trailing newline or space break the base64-encoded secret for Gemini?,c8ca21af33
Is it better to put the keys in a .env file and start docker compose with --env-file?,c8ca21af33
Why can't I just use a notebook for this module instead of an orchestrator like Kestra?,193612db63
"What does Kestra add that a normal script or notebook doesn't, especially for AI workflows?",193612db63
"In Module 3, is Kestra only for orchestration, or is it also used to show AI Copilot, RAG, and agents?",193612db63
"Can I switch between OpenAI, Gemini, Anthropic, etc. in Kestra without rewriting the flow?",193612db63
What is the main reason the course uses Kestra here instead of just running code cell by cell?,193612db63
"Do I have to use Kestra for the whole LLM Zoomcamp, or is it only for the orchestration module?",cce328db64
"For the final project, can I use Airflow, Prefect, Dagster, or even just a Python script instead of Kestra?",cce328db64
"If I build the ingestion pipeline in a notebook, do I still get full credit, or is a script required?",cce328db64
Why does the course use Kestra in Module 3 if other orchestrators can do scheduling and retries too?,cce328db64
"Can I switch between OpenAI, Gemini, Anthropic, or other AI providers in a Kestra flow without rewriting everything?",cce328db64
"Does Kestra only work with Gemini, or can I plug in OpenAI, Anthropic, Groq, or even Ollama/local models too?",f442efe5b4
"If I want to switch from Gemini to another AI provider in a Kestra flow, do I need to rewrite the whole workflow or just change the provider settings?",f442efe5b4
"Is Groq supported in Kestra, and does it work with the OpenAI-compatible APIs?",f442efe5b4
What’s the difference between Kestra’s generic AI plugin and the vendor-specific plugins like the Gemini or OpenAI ones?,f442efe5b4
"How do I use a local model in Kestra, like one running in Ollama or LM Studio?",f442efe5b4
"Can I build a Kestra flow without writing YAML by hand, and what are the no-code choices?",bfe5502c30
"Is there a form-based editor in Kestra, or is it more like drag-and-drop tools such as n8n?",bfe5502c30
"How does the AI Copilot help create a workflow in Kestra, and can I keep editing it with follow-up prompts?",bfe5502c30
"Can I generate Kestra workflows from my editor using tools like Claude Code, Codex, or Kestra CTL instead of the UI?",bfe5502c30
"If my automation is very simple, should I still use Kestra, or would Zapier or n8n be easier?",bfe5502c30
Why do AI tools sometimes make up Kestra YAML fields that aren't actually valid for my version?,93a3e8b98c
How can I check if the YAML an assistant generated for a Kestra plugin is real and not just guessed?,93a3e8b98c
Is there a safer way to generate Kestra flow YAML than using a generic chatbot?,93a3e8b98c
What should I do when a Kestra flow works in one version but the same properties fail in another?,93a3e8b98c
Can you show how to spot a wrong GCS Upload or BigQuery LoadFromGcs config and fix it?,93a3e8b98c
Why do we need to watch token usage in Kestra flows if the LLM call already works?,a4adc70f41
How does tracking tokens in a Kestra workflow help keep AI costs under control?,a4adc70f41
What’s the point of logging token counts from each LLM response in Kestra?,a4adc70f41
How can token monitoring help when a workflow runs in loops or on a schedule?,a4adc70f41
Does Kestra let you use token usage numbers for alerts or dashboards to spot expensive runs?,a4adc70f41
How do I get rid of the Docker Desktop error that says mounts denied and the path /tmp/... is not shared from the host?,dd8b4c9fda
"When I run Kestra with Docker Compose, why do I get a mount denied error for /tmp/kestra-wd and how can I fix it?",dd8b4c9fda
What should I change in Docker Desktop if it refuses to mount a folder under /tmp for a container?,dd8b4c9fda
Is there a setting in Docker Desktop for allowing /tmp or /tmp/kestra-wd to be shared with containers?,dd8b4c9fda
"After adding the shared path in Docker Desktop, do I need to restart anything before running docker compose up -d again?",dd8b4c9fda
"For the Module 3 Kestra homework, what exactly am I supposed to put in the public repo if I did everything in the Kestra UI?",f29f622684
"Do I need to submit the actual Kestra flow YAML files for homework, or is just filling out the form answers enough?",f29f622684
"If my homework only happened inside Kestra, what files should I download and commit before I share the repo link?",f29f622684
Should I include any scripts or helper files along with the Kestra flows when I submit Module 3?,f29f622684
"Is a README required for the Kestra homework repo, or can I just upload the flow files and send the link?",f29f622684
Why do I keep getting JSONDecodeError: Expecting value when I try to generate ground-truth questions with the LLM?,a3c7e1b4f9
How can I make the model return clean JSON instead of wrapping it in a code block or adding extra text?,a3c7e1b4f9
What should I set in the OpenAI chat completion call so json.loads works without failing?,a3c7e1b4f9
What exact instruction should I put in the prompt so the output is a JSON object with 5 questions only?,a3c7e1b4f9
Does Gemini or Groq have a similar way to force JSON output for this evaluation task?,a3c7e1b4f9
"Why does my Jupyter kernel keep crashing when I try to embed the ground-truth set in Module 4, and what should I do about low RAM?",b8f2d6a30c
"Is there a lighter embedding model I can use in the eval notebook, and do I need to rerun the metrics after changing it?",b8f2d6a30c
Can I move the embedding part out of the notebook into a separate Python script and then load the vectors back later?,b8f2d6a30c
What’s the best way to avoid memory issues in Codespaces when loading an embedding model plus the notebook state?,b8f2d6a30c
Should I process the ground-truth data in batches and clear memory between batches if the kernel dies?,b8f2d6a30c
Why do I still hit Gemini rate limits when I already added `time.sleep(4)` in my loop?,c1e9f4b820
What should I do if the free Gemini quota gets exhausted while I'm generating the ground-truth dataset?,c1e9f4b820
Is it better to switch to OpenAI `gpt-4o-mini` or keep using Gemini for this evaluation task?,c1e9f4b820
How can I avoid losing all my progress if the API cuts me off halfway through a long `tqdm` run?,c1e9f4b820
What’s the easiest free or cheap workaround for generating the full ground-truth set without hitting request limits?,c1e9f4b820
How do I fix the Windows WinError 126 about fbgemm.dll not being found when importing torch?,15e931476c
"I’m getting ""The specified module could not be found"" for torch\lib\fbgemm.dll on Windows — what should I install?",15e931476c
What are the fixes for the fbgemm.dll import error in PyTorch on Windows 10/11?,15e931476c
Do I need Visual C++ Redistributable or full Visual Studio to solve the torch fbgemm.dll missing dependency error?,15e931476c
"Why does PyTorch fail with OSError: [WinError 126] on Windows, and how can I get past the fbgemm.dll issue?",15e931476c
I'm getting psycopg2 OperationalError in prep.py: could not translate host name postgres to address. What should I change so it works?,4b65d5542d
"Why does my python prep.py fail with No such host is known for postgres, and how can I fix the connection?",4b65d5542d
"When I run prep.py, psycopg2 says it can't resolve postgres. Do I need to update something in the .env file?",4b65d5542d
How do I stop the postgres host resolution error in Module 5 Monitoring when running the prep script?,4b65d5542d
My prep.py crashes with OperationalError about host postgres. What value should POSTGRES_HOST be set to?,4b65d5542d
How can I make Pandas stop cutting off long text in a column and show the full content?,641aedbbf5
"In the offline-rag-evaluation notebook, how do I display the whole Explanation column instead of getting '...' in the output?",641aedbbf5
What Pandas setting should I change if I want to see the complete judge LLM explanation in a dataframe cell?,641aedbbf5
"Why does Pandas only show part of my text column, and how can I increase or remove that limit?",641aedbbf5
Is there a quick command to let Pandas print full strings in columns without truncating them?,641aedbbf5
How do I normalize each vector in a Pandas DataFrame column?,5039707c1a
What’s a simple way to divide every vector in a Pandas Series by its length?,5039707c1a
Can I use apply with NumPy to normalize vectors in one DataFrame column?,5039707c1a
How would I create a new column with normalized vectors from an existing column?,5039707c1a
Is there a quick lambda function for vector normalization in Pandas?,5039707c1a
How do I calculate the 75th percentile for a pandas DataFrame column?,b4c8ac5a0c
What’s the pandas way to get a 0.75 quantile from a Series?,b4c8ac5a0c
How can I find a column’s percentile value in pandas without using numpy?,b4c8ac5a0c
What code do I use to compute a quantile for a DataFrame column in pandas?,b4c8ac5a0c
"How do I get the 75% cutoff value from df[""col""] in pandas?",b4c8ac5a0c
"How do I force-remove every Docker container from the terminal, including ones that are still running?",66ccbb7da0
What’s the quickest command to delete all Docker images at once from the command line?,66ccbb7da0
How can I wipe out every Docker volume using terminal commands?,66ccbb7da0
"Is there a simple way to clean up all Docker containers, images, and volumes in one go?",66ccbb7da0
"After using Docker a lot, how can I fully clear containers, images, and volumes from the CLI?",66ccbb7da0
"How can I make sure a user can only leave one feedback vote, like +1 or -1, for each submission in Streamlit?",2e729f1271
Why does `st.session.submitted` keep switching back to `True` after I press one of the feedback buttons?,2e729f1271
I want the feedback buttons to stay disabled unless a new query is submitted — what am I missing with Streamlit session state?,2e729f1271
"After clicking the ask button, how do I prevent the session flag from getting reassigned so the user can’t vote twice?",2e729f1271
Is there a known fix for `st.session.submitted` being reset in a Streamlit app when handling feedback buttons?,2e729f1271
"Why am I getting `exec: ""streamlit"": executable file not found in $PATH` when I start my app with docker-compose, even though it works normally on my machine?",e8df9f0d12
What should I check in my Docker setup if docker-compose fails to create the container task because it can’t find the `streamlit` command?,e8df9f0d12
Do I need a Dockerfile for a Streamlit app that I want to run with docker-compose?,e8df9f0d12
How do I fix the issue where a Streamlit container starts fine outside docker-compose but crashes with an OCI runtime error inside it?,e8df9f0d12
"After updating my docker-compose file for Streamlit, what command should I run to rebuild everything and bring the app back up?",e8df9f0d12
"Is the capstone project supposed to be done by one person, or can we submit it as a group?",0fab61eca2
"Can I team up with other students for the capstone, or does each submission need to be separate?",0fab61eca2
"If we build one shared system, is it okay for several people to use it for the capstone?",0fab61eca2
How does the course handle collaboration on the capstone if multiple students work on the same idea?,0fab61eca2
What counts as an acceptable capstone submission if more than one person is involved?,0fab61eca2
"Do I need to submit two capstone projects, or is one enough for the course?",d5fc98925d
What do attempt 1 and attempt 2 mean for the capstone project submission?,d5fc98925d
"If my first capstone submission doesn’t pass, can I fix it and send it again later?",d5fc98925d
"Can I submit two projects just to get more practice, and if so, do they need to be different?",d5fc98925d
"What happens if I miss the first submission window — can I still join in for the second one, and does peer review matter for certification?",d5fc98925d
"Can I count the competition as my capstone project, or are they separate?",e892d44e42
"Is the capstone in llm-zoomcamp meant to be done alone, or can we work as a team?",e892d44e42
"If I join the math-kaggle-llm-competition, does that replace the capstone requirement?",e892d44e42
"Are team submissions allowed for the capstone, or only for the competition?",e892d44e42
What’s the difference between the competition and the capstone in the Capstone Project section?,e892d44e42
How will my capstone project be graded in this course?,9a2e2d2008
Who reviews the capstone project after I submit it?,9a2e2d2008
Do I also need to grade other students’ capstone projects?,9a2e2d2008
What happens if I don’t complete the peer-review requirement for capstone?,9a2e2d2008
How is the final score for the capstone project calculated?,9a2e2d2008
"After the submission deadline, how are the projects for review assigned to each participant?",eae0fb50aa
When do we get the list of projects to grade in the capstone project?,eae0fb50aa
How many projects will each participant be assigned to review after submissions close?,eae0fb50aa
Will the project review assignments be shared in a spreadsheet or some other format?,eae0fb50aa
"For the capstone project, what happens with grading once the deadline has passed?",eae0fb50aa
I already sent in my capstone project — why am I still not able to see anything to review?,a8a7fef016
"After the project deadline, do we pick which submissions to evaluate, or are they assigned automatically?",a8a7fef016
Is there a reason I can’t start reviewing other projects before the review list is out?,a8a7fef016
"Once submissions are closed, when do we get assigned projects for evaluation?",a8a7fef016
Do I have any control over which capstone projects I’m supposed to review?,a8a7fef016
Where can I find project ideas and datasets for the capstone project?,e76a70cde3
Is there a page with some good dataset ideas for the LLM Zoomcamp project?,e76a70cde3
What’s the best place to look for project inspiration and data sources for this capstone?,e76a70cde3
"Can you point me to a GitHub page with ideas, datasets, and guidelines for the project?",e76a70cde3
I’m stuck on the project topic—where should I look for suggestions and usable datasets?,e76a70cde3
"Do I actually need Airflow, Mage, or Kestra for the capstone project, or is a simple Python script enough?",d4f7c08ea1
"If I build the ingestion and indexing steps in a plain Python script, can I still get full points for that pipeline criterion?",d4f7c08ea1
"Is a Jupyter notebook with the ingestion steps considered okay for the capstone, or is it worth fewer points than a script?",d4f7c08ea1
When would it make sense to use an orchestrator in the capstone instead of just writing Python code?,d4f7c08ea1
"Should I add an orchestration tool only to satisfy the grading rubric, or only if my project really needs recurring ingestion?",d4f7c08ea1
How can I evaluate a recommender-style RAG if I don’t have clear ground-truth Q&A pairs?,9b0e2d6a47
What’s a good way to create synthetic test data for a retrieval system when the dataset items are the answers?,9b0e2d6a47
"For ranking-style RAG, should I use hit rate or NDCG, and why?",9b0e2d6a47
"Can I use an LLM as a judge to score the quality of my RAG results, and how would that work?",9b0e2d6a47
"If multiple results could be acceptable in my recommender RAG, what metric makes the most sense to measure retrieval quality?",9b0e2d6a47
What's a good way to chunk a huge corpus with long PDFs and lots of paragraphs?,6f2a8b3d10
Should I spend time finding the perfect chunking method before I start indexing?,6f2a8b3d10
"Is it okay to begin with simple fixed-size chunks, and what size would you suggest?",6f2a8b3d10
"How can I chunk long, structured docs like legal or financial PDFs without losing exact wording?",6f2a8b3d10
Are there any tools you recommend for turning PDFs into cleaner text or markdown before chunking?,6f2a8b3d10
"What does reproducibility mean for the capstone project, and do reviewers need my API keys to run it?",e5d8a2c761
How should I set up my repo so someone can clone it and rebuild the project from scratch without using my credentials?,e5d8a2c761
